{"$schema":"https://json-schema.org/draft/2020-12/schema","$id":"https://pumpitspace.github.io/synevyr-go/schemas/routing-table-golden.schema.json","type":"object","required":["schema_version","baseline_commit","source","cases"],"properties":{"schema_version":{"const":1},"baseline_commit":{"type":"string","pattern":"^[0-9a-f]{40}$"},"source":{"const":"jasmin/routing/RoutingTables.py"},"cases":{"type":"array","minItems":23,"maxItems":23,"items":{"type":"object","required":["id","source","direction","operations","query","expected"],"properties":{"id":{"type":"string"},"source":{"const":"jasmin/routing/RoutingTables.py"},"direction":{"enum":["mt","mo"]},"operations":{"type":"array"},"query":{"type":["object","null"]},"expected":{"type":"object","required":["orders","remove_results","selected","error_type"],"properties":{"orders":{"type":"array","items":{"type":"integer"}},"remove_results":{"type":"array","items":{"type":"boolean"}},"selected":{"type":["object","null"]},"error_type":{"type":["string","null"]}},"additionalProperties":false}},"additionalProperties":false}}},"additionalProperties":false}
