{
  "baseline_commit": "0aac58e466d583d0f0436df7b8afa3dc96191263",
  "cases": [
    {
      "direction": "mt",
      "expected": {
        "error_type": null,
        "orders": [
          3,
          2,
          1,
          0
        ],
        "remove_results": [],
        "selected": null
      },
      "id": "mt_descending_order",
      "operations": [
        {
          "op": "add",
          "order": 0,
          "route": {
            "connector": {
              "id": "default",
              "type": "smppc"
            },
            "direction": "mt",
            "filters": [],
            "kind": "default",
            "rate": 0.0
          }
        },
        {
          "op": "add",
          "order": 2,
          "route": {
            "connector": {
              "id": "d",
              "type": "smppc"
            },
            "direction": "mt",
            "filters": [
              {
                "pattern": "^10\\d+",
                "type": "destination"
              }
            ],
            "kind": "static",
            "rate": 0.0
          }
        },
        {
          "op": "add",
          "order": 1,
          "route": {
            "connector": {
              "id": "u",
              "type": "smppc"
            },
            "direction": "mt",
            "filters": [
              {
                "type": "user",
                "user_id": 1
              }
            ],
            "kind": "static",
            "rate": 0.0
          }
        },
        {
          "op": "add",
          "order": 3,
          "route": {
            "connector": {
              "id": "t",
              "type": "smppc"
            },
            "direction": "mt",
            "filters": [
              {
                "type": "transparent"
              }
            ],
            "kind": "static",
            "rate": 0.0
          }
        }
      ],
      "query": null,
      "source": "jasmin/routing/RoutingTables.py"
    },
    {
      "direction": "mo",
      "expected": {
        "error_type": null,
        "orders": [
          3,
          2,
          1,
          0
        ],
        "remove_results": [],
        "selected": null
      },
      "id": "mo_descending_order",
      "operations": [
        {
          "op": "add",
          "order": 0,
          "route": {
            "connector": {
              "id": "default",
              "type": "smpps"
            },
            "direction": "mo",
            "filters": [],
            "kind": "default",
            "rate": 0.0
          }
        },
        {
          "op": "add",
          "order": 2,
          "route": {
            "connector": {
              "id": "dst",
              "type": "http"
            },
            "direction": "mo",
            "filters": [
              {
                "pattern": "^90\\d+",
                "type": "destination"
              }
            ],
            "kind": "static",
            "rate": 0.0
          }
        },
        {
          "op": "add",
          "order": 1,
          "route": {
            "connector": {
              "id": "src",
              "type": "http"
            },
            "direction": "mo",
            "filters": [
              {
                "pattern": "^10\\d+",
                "type": "source"
              }
            ],
            "kind": "static",
            "rate": 0.0
          }
        },
        {
          "op": "add",
          "order": 3,
          "route": {
            "connector": {
              "id": "top",
              "type": "http"
            },
            "direction": "mo",
            "filters": [
              {
                "type": "transparent"
              }
            ],
            "kind": "static",
            "rate": 0.0
          }
        }
      ],
      "query": null,
      "source": "jasmin/routing/RoutingTables.py"
    },
    {
      "direction": "mt",
      "expected": {
        "error_type": null,
        "orders": [
          2
        ],
        "remove_results": [],
        "selected": {
          "connector_id": "new",
          "rate": 0.0
        }
      },
      "id": "replace_same_order",
      "operations": [
        {
          "op": "add",
          "order": 2,
          "route": {
            "connector": {
              "id": "old",
              "type": "smppc"
            },
            "direction": "mt",
            "filters": [
              {
                "type": "transparent"
              }
            ],
            "kind": "static",
            "rate": 0.0
          }
        },
        {
          "op": "add",
          "order": 2,
          "route": {
            "connector": {
              "id": "new",
              "type": "smppc"
            },
            "direction": "mt",
            "filters": [
              {
                "type": "transparent"
              }
            ],
            "kind": "static",
            "rate": 0.0
          }
        }
      ],
      "query": {
        "destination": "x",
        "direction": "mt",
        "source": "x",
        "user_id": 2
      },
      "source": "jasmin/routing/RoutingTables.py"
    },
    {
      "direction": "mt",
      "expected": {
        "error_type": null,
        "orders": [],
        "remove_results": [
          true
        ],
        "selected": null
      },
      "id": "remove_existing",
      "operations": [
        {
          "op": "add",
          "order": 2,
          "route": {
            "connector": {
              "id": "x",
              "type": "smppc"
            },
            "direction": "mt",
            "filters": [
              {
                "type": "transparent"
              }
            ],
            "kind": "static",
            "rate": 0.0
          }
        },
        {
          "op": "remove",
          "order": 2
        }
      ],
      "query": null,
      "source": "jasmin/routing/RoutingTables.py"
    },
    {
      "direction": "mt",
      "expected": {
        "error_type": null,
        "orders": [],
        "remove_results": [
          false
        ],
        "selected": null
      },
      "id": "remove_missing",
      "operations": [
        {
          "op": "remove",
          "order": 9
        }
      ],
      "query": null,
      "source": "jasmin/routing/RoutingTables.py"
    },
    {
      "direction": "mt",
      "expected": {
        "error_type": null,
        "orders": [],
        "remove_results": [],
        "selected": null
      },
      "id": "flush_table",
      "operations": [
        {
          "op": "add",
          "order": 1,
          "route": {
            "connector": {
              "id": "x",
              "type": "smppc"
            },
            "direction": "mt",
            "filters": [
              {
                "type": "transparent"
              }
            ],
            "kind": "static",
            "rate": 0.0
          }
        },
        {
          "op": "flush"
        }
      ],
      "query": null,
      "source": "jasmin/routing/RoutingTables.py"
    },
    {
      "direction": "mt",
      "expected": {
        "error_type": null,
        "orders": [
          2,
          1,
          0
        ],
        "remove_results": [],
        "selected": {
          "connector_id": "user",
          "rate": 0.0
        }
      },
      "id": "mt_first_match_user",
      "operations": [
        {
          "op": "add",
          "order": 0,
          "route": {
            "connector": {
              "id": "default",
              "type": "smppc"
            },
            "direction": "mt",
            "filters": [],
            "kind": "default",
            "rate": 0.0
          }
        },
        {
          "op": "add",
          "order": 2,
          "route": {
            "connector": {
              "id": "dest",
              "type": "smppc"
            },
            "direction": "mt",
            "filters": [
              {
                "pattern": "^10\\d+",
                "type": "destination"
              }
            ],
            "kind": "static",
            "rate": 0.0
          }
        },
        {
          "op": "add",
          "order": 1,
          "route": {
            "connector": {
              "id": "user",
              "type": "smppc"
            },
            "direction": "mt",
            "filters": [
              {
                "type": "user",
                "user_id": 1
              }
            ],
            "kind": "static",
            "rate": 0.0
          }
        }
      ],
      "query": {
        "destination": "200",
        "direction": "mt",
        "source": "x",
        "user_id": 1
      },
      "source": "jasmin/routing/RoutingTables.py"
    },
    {
      "direction": "mt",
      "expected": {
        "error_type": null,
        "orders": [
          2,
          1,
          0
        ],
        "remove_results": [],
        "selected": {
          "connector_id": "dest",
          "rate": 0.0
        }
      },
      "id": "mt_first_match_destination",
      "operations": [
        {
          "op": "add",
          "order": 0,
          "route": {
            "connector": {
              "id": "default",
              "type": "smppc"
            },
            "direction": "mt",
            "filters": [],
            "kind": "default",
            "rate": 0.0
          }
        },
        {
          "op": "add",
          "order": 2,
          "route": {
            "connector": {
              "id": "dest",
              "type": "smppc"
            },
            "direction": "mt",
            "filters": [
              {
                "pattern": "^10\\d+",
                "type": "destination"
              }
            ],
            "kind": "static",
            "rate": 0.0
          }
        },
        {
          "op": "add",
          "order": 1,
          "route": {